"1945/01/06","Near Dinjan, India","China National Aviation Corporation",NULL,"Kunming - Tengchung","Douglas C-47","77",NULL,0,4,0,4,0,"The cargo plane crashed in strong winds"
"1945/01/08","Port of Spain, Trinidad","Pan American World Airways","161","Miami - Leopoldville","Martin M-130 (flying boat)","NC14716","558",NULL,NULL,NULL,NULL,0,"The aircraft crashed 1.25 miles short of the intended landing area in a nose-down attitude at too great a speed and broke up in the water. The first officers failure to realize his proximity to the water and to correct his attitude for a normal landing and the lack of adequate supervision by the captain during the landing, resulting in the inadvertent flight into the water in excess of normal landing speed and in a nose-down attitude. The aircraft was named China Clipper."
"1945/01/10","Burbank, California","American Airlines","6001","New York City - Juarez, Mexico - Burbank","Douglas DC-3","NC25684","2215",2,3,2,3,0,"The aircraft, lost in fog, crashed into the Verdugo Mountains,while attempting to reach Palmdale Airport, its alternate landing site, after being unable to land at Burbank Airport. The company ground personnel failed to obtain and transmit important weather to the pilot. Improperly executed missed approach by the pilot. Actress Donna Reed was returning from Juarez where she obtained a divorce from her husband but was bumped from the flight just prior to takeoffto make room for a military officer holding a wartime-travel priority pass."
"1945/01/14","China","China National Aviation Corporation",NULL,NULL,"Douglas C-47","70",NULL,0,6,0,4,0,"The cargo plane struck a mountain."
"1945/01/16","Near Kunming, China","China National Aviation Corporation",NULL,"Chongqing - Kunming","Douglas C-47",NULL,NULL,0,3,0,3,0,NULL
"1945/01/23","Timor, Indonesia","Military - Royal Australian Air Force",NULL,NULL,"Consolidated Liberator","A72-70",NULL,NULL,NULL,NULL,NULL,0,NULL
"1945/01/31","Redesdale, Australia","Australian National Airways",NULL,"Melbourne - Broken Hill","Stinson Model A","VH-UYY",NULL,8,2,8,2,0,"Crashed while en route from Melbourne to Broken Hill. Believed caused by metal fatigue in the outer port wing which broke off during severe turbulence."
"1945/02/02","Near Montieri, Italy","Military - U.S. Army Air Forces",NULL,NULL,"Douglas C-47-DL","41-18603","4728",2,4,2,2,0,"Crashed into a hill after encountering a fog bank and not climbing in sufficient time to avoid the terrain."
"1945/02/06","Nunters Burgh, England","Military -Royal Air Force",NULL,NULL,"Douglas C-47 Dakota","KG630","13390",1,4,1,4,0,"Struck a mountain while flying in low clouds and poor visibility."
"1945/02/13","Off Oakland, California","Military - U.S. Navy",NULL,NULL,"Douglas R4D-6","50765",NULL,2,3,2,3,0,"Crashed into San Francisco bay shortly after taking off. The right wing struck to water as the plane made a wide turn."
"1945/02/15","Lagoa Santa, Brazil","Navegacao Aerea Brasileira",NULL,NULL,"Lockheed 18 Loadstar","PP-NAE","2149",7,4,7,4,0,"Crashed while en route."
"1945/02/23","Casablanca, Morocco","Military - United States Army Air Force",NULL,NULL,"Curtiss C-46A","42-107377","27064",NULL,NULL,NULL,NULL,0,NULL
"1945/02/23","Snezka mountains, Poland","Military - German Army",NULL,NULL,"Junkers 52/3m",NULL,NULL,NULL,NULL,NULL,NULL,NULL,"Crashed in the Snezka mountains during an ice storm."
"1945/02/23","Marion, Virginia","American Airlines","9","New York City - Los Angeles","Douglas DC-3","NC18142","2138",1,3,1,2,0,"The aircraft flew into the summit of Glade mountain at 3,900 ft., in heavy rain and turbulencewhile en route. The pilots failure to properlyplan the flight and remain at a safe instrument altitude under existing conditions. A contributing cause of the accident was the companys laxity in dispatching and supervising the flight."
"1945/03/27","Coral Sea, off Australia","Military - U.S. Air Force",NULL,NULL,"Douglas C-47A-90-DL","43-16011","20477",2,4,2,4,0,"Disappeared en route."
"1945/04/09","Kunming, China","China National Aviation Corporation",NULL,"Kunming - Sichang","Douglas C-47","88",NULL,0,3,0,3,0,"The cargo plane struck a mountain in the Himalayas under poor weather conditions."
"1945/04/14","Morgantown, West Virginia","Pennsylvania Central Airlines","142","Pittsburgh - Morgantown","Douglas DC-3","NC25692","2262",1,3,1,3,0,"The aircraft crashed against the slope of Cheat Mountain at 2,100 ft., 7 miles east northeast of Morgantown. The action of the pilot in continuing flight over mountainous terrain under instrument conditions, below the minimum authorized instrument altitude."
"1945/04/19","Near Perth, Australia","Military - U.S. Navy","-",NULL,"Douglas DC-3","39067",NULL,1,2,1,2,0,"The transport crashed into a hillside as it took off in heavy fog at Guildford Airport."
"1945/04/20","Sweetwater, Texas","Military - U.S. Army Air Forces",NULL,"Midland, TX - Nashville, TN","Douglas C-47-DL","41-18451","4513",2,5,2,5,0,"Broke-up after entering an area of thunderstorms. Initial structural failure involved the elevator followed by the entire aircraft."
"1945/04/20","Near Steinreich, Germany","Lufthansa",NULL,"Berlin - Munich","Junkers JU-53/3m","D-ANAJ",NULL,1,3,1,3,0,"Missing on an evacuation flight from Berlin to Munich. Shot down by Soviet forces south of Berlin."
"1945/04/21","Near Piesenkofen, Germany","Deutsche Lufthansa",NULL,"Berlin - Munich","Focke-Wulf FW 200","D-ASHH",NULL,1,5,1,5,0,"Shot down by Allied forces 50 miles from its destination."
"1945/04/23","North Barrule, Isle of Man, England","Military - U.S. Air Force",NULL,"Ridgewell - Nutts Corner","B17G Flying Fortress","43-38856",NULL,2,5,2,5,0,NULL
"1945/04/27","Washington D.C.","Page Airways",NULL,"Washington, D.C. - New York, Ny","Lockheed 18 Lodestar","NC33328","2221",1,2,6,0,0,"Lost an engine during takeoff, settled back on the runway, overran the runway, rolled to the right and crashed into a drainage ditch and burned. Engine failure during a critical point in the take-off followed by the pilot executing an emergency landing under unfavorable conditions. Contributing factors were the strong gusts and ground turbulence which prevailed at the time and the presence of a deep ditch near the runway."
"1945/05/05","Manus Island, New Guinea","Military - U.S. Army Air Forces",NULL,NULL,"Douglas C-54E-DO (DC-4)","44-9043","27269",1,6,1,6,0,"Crashed into a hill shortly after taking off from Sorido airstrip. Cause unknown."
"1945/05/06","Hindhead, England","Military - U.S. Army Air Forces",NULL,NULL,"Curtiss-Wright C-46D-CU","44-77839","33235",2,5,2,5,1,"Flying low because of poor visiblity, the aircraft struck a radar tower, lost its right wing, crashed and burned. Pilot error. Flying VFR in IFR conditions."
"1945/05/09","Roye, France","Military -Royal Air Force",NULL,"England - Brussels","Avro Lancaster","RF230",NULL,2,6,2,6,0,"The aircraft went in to a spin and crashed in a wooded area and caught fire."
"1945/05/13","Netherlands, New Guinea","Military - U.S. Army Air Forces",NULL,NULL,"Douglas C-47B-DK","43-49788","27049",NULL,NULL,NULL,NULL,0,"Crashed into mountains."
"1945/05/30","Off Drewin, Ivory Coast","Military - U.S. Army Air Forces",NULL,"Accra, Ghana - Monrovia, Liberia","Douglas C-47B-dK","44-76406","32738",1,3,1,3,0,"Disappeared off the Atlantic coast after sending a distress message. A witness observed the plane hit the water at a 45 degree angle. No wreckage or bodies were ever found."
"1945/06/15","China","China National Aviation Corporation",NULL,NULL,"Douglas C-47","81",NULL,0,3,0,3,0,"The aircraft crashed into a mountain in the Carstenz Range at an altitude of 14,200 ft. The wreckage was discovered in December 1970."
"1945/06/24","Gealdton, Australia","Mac Robertson Miller Airlines",NULL,NULL,"de Havilland DH-86A","VH-USF","2310",9,2,1,1,0,NULL
"1945/06/25","Swanage, England","Military -Royal Air Force",NULL,NULL,"Consolidated LB-30A Liberator","JT985",NULL,NULL,NULL,NULL,NULL,0,"Crashed and burned on a hillside after experiencing engine failure."
"1945/06/29","Bangalore, India","Military - Royal Indian Air Force",NULL,NULL,NULL,NULL,NULL,NULL,NULL,NULL,NULL,36,"Crashed into a village exploding and destoying several houses."
"1945/06/30","Texas","Military - U.S. Air Force",NULL,NULL,"Boeing TB-29A Super Fortress","44-69943",NULL,NULL,NULL,NULL,NULL,0,NULL
"1945/07/04","North Atlantic Ocean","Military -Royal Air Force",NULL,"Montreal, Canada - England","Consolidated LB-30A Liberator","JT982",NULL,NULL,NULL,NULL,NULL,0,"Disappeared on a trans-Atlantic flight from Montreal to England."
"1945/07/11","Near Kisumu, Kenya","Military - South African Air Force",NULL,NULL,"Douglas C-47","6812",NULL,2,4,2,4,0,"Crashed shortly after take off into Lake Victoria."
"1945/07/12","Near Florence, South Carolina","Eastern Air Lines / Military - U.S. Army Air Corps","45","Boston - NY - Washington DC - Jacksonville - Miami","Douglas DC-3-201C /Army A-26","NC25647","2235",4,6,1,2,0,"After deviating off course 8 miles to avoid military traffic, the two planes collided at 3,000 ft. The commercial pilot landed the plane in a corn field.Two occupants of the A-26 (33-35553) were killed and one parachuted safely. One infant was killed on the DC-3.Lack of vigilance on the partof the pilots of both aircraft, resulting in the failure of each pilot to see the other aircraft in time toavoid a collision."
"1945/07/28","New York, New York","Military - U.S. Army Air Forces",NULL,NULL,"North American B-25D bomber","43-0577",NULL,1,2,1,2,11,"A U.S. Army Air Force plane crashed into the 79th floor of the Empire State Building in heavy fog.Lt. Col. William Franklin Smith Jr., the pilot, became disoriented while trying to land at Newark Airport.Lt. Smith was told he had a 3 hour wait to land at Newark. Impatient to get his plane on the ground, he falsely declared he had official business at La Guardia Airport with the intention of diverting to Newark as soon as he was cleared. The 12 ton plane smashed a 20 ft. hole in the building. Fuel from the ruptured gas tanks poured out and set two floors ablaze killing 10 people. One engine exited the south side of the building and plunged into a penthouse below.The second engine entered an elevator shaft and severed the cables plunging the car and the elevator operator 1,000 feet into a sub basement. Despite suffering a broken back and legs, she survived."
"1945/08/01","Near San Luis Potosi, Mexico","Lineas Aereas Mineras",NULL,"Mexico City - Nogales","Boeing 247D","XA-DUY","1723",9,3,9,3,0,"Crashed into mountainous terrain after encountering engine failure.."
"1945/08/03","Fort de France, Martinique","Pan American World Airways","216","Port of Spain - Fort de France","Sikorsky S-43 (flying boat)","NC15066","4306",1,4,4,0,0,"The aircraft crashed while landing at Fort de France. The plane sank and 4 passengers drowned. The attempt by the pilot to land the aircraft in conditions of water surface not suitable for landing of a flying boat."
"1945/08/11","Ixtaccihuati, Mexico","Mexicana",NULL,NULL,"Douglas DC-2-243","XA-DOT","2075",1,4,1,4,0,"Crashed in Ixtaccihuatl mountain 40 miles east-sout-east of Mexico City. Navigational error as the crews last message stated they were in an entirely different area."
"1945/09/07","Florence, South Carolina","Eastern Air Lines","42","Miami - New York City","Douglas DC-3","NC33631","4137",1,3,1,3,0,"Fire was discovered on board the aircraft after having passed Florence. The fire originated in the general area of the right side of the rear cargo compartment and lavatory. The aircraft descended to a lower altitude while returning to Florence, struck two largetrees and crashed.A fire of undetermined origin in the rear cargo compartment or lavatory which resulted in the inability of the pilot to maintain altitude long enough to effect an emergency landing."
"1945/09/11","Near Milne Bay, New Guinea","Military - Royal Australian Air Force",NULL,"Milne Bay - Dobodura","Douglas C-47A","A6556","25365",7,4,7,4,0,"Left Milne Bay on routine flightto Dobodura at 10:15. Crashed into sea near Milne Bay."
"1945/09/15","Near Kansas, Missouri","Military - U.S. Army Air Forces",NULL,NULL,"Douglas C-47B-DK","45-1011","34277",2,3,2,3,0,"Failed to gain altitude while taking off, struck trees, lost both wings, exploded and burned. Engine failure."
"1945/09/18","Puncak Jaya, Papua New Guinea","Military - Royal Australian Air Force",NULL,NULL,"Douglas C-47B-5-DK","A65-61","14554/25999",2,3,2,3,0,NULL
"1945/09/28","Near Chihkiang, China","Military - United States Army Air Force",NULL,NULL,"Curtiss C-46D","42-101183","30638",NULL,NULL,NULL,NULL,0,NULL
"1945/10/05","Elvetham, England","Military -Royal Air Force",NULL,"England - Prague","Consolidated LB-40-A Liberator",NULL,NULL,1,5,1,5,0,"Cashed and burned shortly after takeoff after experiencing an engine fire in the No. 2 engine."
"1945/10/05","Lakeland, Florida","National Airlines","16","Miami - Jacksonville","Lockheed 18 Lodestar","NC18199","2265",1,3,2,0,0,"Crashed into a lake while attempting to execute a missed approach. The faulty execution of a missed approach procedure resulting in settling of the aircraft into a water area beyond the landing runway."
"1945/10/07","Rennes, France","Military - Royal Air Force",NULL,"London - Cairo","Short Stirling IV","LJ668",NULL,2,6,2,6,0,"Lost altitude while in a turn and attempting to land and crashed and burned."
"1945/10/13","Melsbroek, Belgium","Military -Royal Air Force",NULL,"Belgium - India","Consolidated LB-30-A Liberator","KL595",NULL,2,6,2,6,0,"The aircraft failed to gain speed or altitude and struck a hill at the end of the runway."
"1945/10/16","Near Peking, China","Military - U.S. Army Air Forces",NULL,"Hankou - Peking","Curtiss-Wright C-46F-CU","44-78591","22414",5,4,5,4,0,"Struck a radio transmission tower while on approach for landing at Nanyman field."
"1945/10/20","Between Shanghi and Canton, China","China National Aviation Corporation",NULL,"Shanghai - Canton","Douglas C-47",NULL,NULL,2,3,2,3,0,"Crashed into a mountain while en route, flying at a low altitude in adverse meteorological conditions."
"1945/10/20","Timor Sea, Atlantic Ocean","Military - Royal Australian Air Force",NULL,"Ambon, Indonesia - Darwin, Australia","Douglas C-47B","A65-83","16127/32875",2,4,2,4,0,"Disappeared en route."
"1945/10/23","Near Chiringa, India","Military - Royal Air Force",NULL,NULL,"Douglas C-47B","KJ957","14804/26249",NULL,NULL,NULL,NULL,0,"Penetrated a thunderstorm and broke-up."
"1945/10/24","Tarapoto, Peru","Faucett",NULL,NULL,"Faucett F-19","OB-PAG-139","24",NULL,NULL,NULL,NULL,0,"Crashed on takeoff."
"1945/10/30","Chihchiang, China","Military - U.S. Army Air Forces",NULL,NULL,"Curtiss-Wright C-46A-CK","43-47228","299",4,4,4,1,0,"Crashed and burned on takeoff striking a hill.Possible engine failure or overloading."
"1945/11/01","Herrenalb, Germany","Military - U.S. Army Air Forces",NULL,NULL,"Douglas C-47A-DK","42-93041","12909",2,4,2,4,0,"The crew descended through low overcast to obtain their position.Followed an river and crashed into wooded mountainside.Navigator error in not informing the pilot of high terrain."
"1945/11/03","Near Chuka, India","Military - U.S. Army Air Forces",NULL,"Chabua - Karachi","Douglas C-54G","45528A",NULL,4,4,4,4,0,"Crashed into the Himalaysas and burned while en route."
"1945/11/07","Near Grants, New Mexico","National Skyway Freight Co.",NULL,"Alberquerque -","Budd RB-1 Conestoga",NULL,NULL,0,3,0,1,0,"After refueling in Alberquerque, the plane, carrying magazins to the west coast, crashed and burned after encountering snow and strong winds. The flight engineer survived."
"1945/11/08","Off Corpus Christi, Texas","Military - U.S. Navy / Military - U.S. Navy",NULL,NULL,"Martin PBM-3S/ Martin PBM-5","01710 / 69113",NULL,NULL,NULL,NULL,NULL,0,"The aircraft expierence a midair collision over Corpus Christi Bay while on a training flight."
"1945/11/09","Near Boccadi, Italy","Military - U.S. Army Air Forces",NULL,"Athens - Naples","Douglas C-47A-DL","42-24363","10225",2,4,2,4,0,"The pilot radioed he was lost, shortly before impacting the ground while attempting to land in poor visibility."
"1945/11/11","Himalayas","Military - U.S. Army",NULL,"Chabau, India - Karachi, Pakistan","Douglas C-54",NULL,NULL,NULL,NULL,NULL,NULL,0,"Crashed into a mountain ridge 200 ft. short of the summit, bounced over the top and crashed down the other side whileen route."
"1945/11/11","Near Castel, Libya","Military -Royal Air Force",NULL,NULL,"Short Stirling","PJ950",NULL,2,7,2,7,0,"Crashed and burned after experiencing an engine fire."
"1945/11/11","Near Picinisco, Italy","Military - U.S. Army Air Forces",NULL,"France - Athens","Boeing B-17G","43-9197",NULL,1,4,1,4,0,"The plane disappeared after the pilot radioed he was exeriencing heavy icing and asked to divert to Rome.The plane was found 5 months later on Mt. Meta."
"1945/11/13","Near Tacloban, Philippines","Australian National Airways",NULL,NULL,"Douglas C-48","VH-CDC",NULL,1,3,1,3,NULL,"Crashed into the sea afte an aborted landing at the island of Leyte. The plane touched down hard, pulled up, circled and crashed into the sea. Pilot error. Decision to land in unfavorable weather."
"1945/11/15","New Britain Island, New Guinea","Military - Royal Australian Air Force",NULL,NULL,"Douglas C-47 Dakota-DK","A6554","26640",2,3,2,3,0,"Crashed into a 7,000 ft. mountain, 150 feet below the ridge, shortly after taking off."
"1945/11/22","Whites Farm, England","Military -Royal Air Force",NULL,NULL,"Consolidated LB-30A Liberator","KH126",NULL,2,5,2,5,0,"The aircraft crashed into a hill shortly after takeoff after andmaking a turn, before reaching the prescribed altitude."
"1945/12/03","Near Rochefort , France","Military -Royal Air Force",NULL,"India - Cambridge, England","Consolidated LB-30A Liberator","KH125",NULL,2,5,2,5,0,"Crashed in severe turbulence in thunderstorms after losing the right wing and breaking up."
"1945/12/05","Off the Florida coast","Military - U.S. Navy","19",NULL,"Five Grumman TBM Avengers",NULL,NULL,0,1,0,1,0,"The five aircraft, (23307) (73209) (46325) (46094) (45714), flying out of the U.S. Naval Air Station at Fort Lauderdale, on a training mission,became lost, ran out of fuel and crashed into the Atlantic Ocean.No trace of the planes were ever found. This was the incident that began the Bermuda Triangle legend."
"1945/12/08","Near Billings, Montana","Military - U.S. Army",NULL,"Newark, N.J. - Seattle, WA","Douglas C-47",NULL,NULL,1,2,1,2,0,"Crashed into a field after hitting trees while attempting to land in a snowstorm."
"1945/12/18","Voksenkollen, Norway","Military - Royal Air Force",NULL,NULL,"Douglas C-47B","KN413","16090/32838",1,4,1,4,0,"Flew into the side of a hill."
"1945/12/25","Bangui, French Equatorial Africa","Air France",NULL,NULL,"Lockheed 18 Lodestar","F-BALV","2380",NULL,NULL,NULL,NULL,0,NULL
"1945/12/25","Near Dudinka, Russia","Polyarnya Aviatsiya",NULL,NULL,"Douglas DC-3",NULL,NULL,6,4,6,4,0,"Crashed 50 miles northwest of Norilsk after catching fire in the air."
"1945/12/30","New York City, New York","Eastern Air Lines","14","Philadelphia - New York City","Douglas DC-3","NC18l23","1999",9,3,1,0,0,"The pilot, in the belief that he was encountering engine trouble, attempted a landing despite a landing approach which was too high and too fast. Initial contact with the runway was made at a point which provided insufficient room for a landing roll and at an airspeed considerable in excess of normal. The pilot was unable to bring the aircraft to a stop in time to avoid overshooting the runway. The decision of the pilot in attempting a landing from an approach which was too high and too fast."
