"1968/01/06","Near Olekminsk, Russia","Aeroflot","1668","Olekminsk - Lensk","Antonov An-24B","CCCP-47733"," 69901001",3,6,3,6,0,"Crashed 92 km from Olekminsk. The cause of the accident could not be determined."
"1968/01/08","Near Quang Tri, South Vietnam","Military - U.S. Marine Corps",NULL,NULL,"Sikorsky CH-53A (helicopter)","153710",NULL,3,5,3,5,0,"Crashed into a mountain south of Dong Ha airfield."
"1968/01/08","Tanana, Alaska","Tanana Air Taxi",NULL,NULL,"Cessna 180H","N7921V",NULL,4,1,1,1,0,"Non-instrument rated pilot attempted night flying in IFR conditions. Spatial disorientation. Continued VFR flight into adverse weather conditions."
"1968/01/08","San Diego, California","Imperial Comm - Air Taxi",NULL,NULL,"Beechcraft E18S","N82B",NULL,3,1,2,1,0,"Engine failure on takeoff. Pilot used improper emergency procedures. Used minimum takeoff run and takeoff speed. Executed steep climb and turn at 50 ft."
"1968/01/10","Near Copper Canyon, Nevada","Military - U.S. Marine Corps",NULL,"Buckley ANGB - Seattle NAS","Douglas C-54P","50850","10427",1,7,1,7,0,"The aircraft hit Mt. Tobin 300 ft. below the peak and slid 1,000 ft. down the side of the mountain. Turbulent conditions caused the uncontrolled descent. The Salt Lake control center had, in response to its vector request, informed the crew that there were no storm cells and no reports of icing along the airway being used. As a result, the pilot was unaware that turbulence encountered would be hazardous, worse than that predicted at the time of take-off. These turbulent conditions apparently caused the uncontrolled descent of the aircraft into the ground. The pilot was technically not qualified for the type of aircraft and was aware of the general weather conditions and should have discontinued the flight.."
"1968/01/13","Minot AFB, North Dakota","Military - US Air Force",NULL,NULL,"KC-135","58-0026",NULL,NULL,NULL,NULL,NULL,0,"The airplane over rotated during takeoff in a snow storm."
"1968/01/15","Zifta, Egypt","United Arab Airlines",NULL,"Cairo - Beirut","Douglas DC-3","SU-AJG",NULL,0,4,0,4,0,"Ice accretion on the lifting surface of the aircraft accompanied by moderate to severe turbulence, which resulted in loss of aircraft control by the pilot. When he tried to regain control over the aircraft the lifting surfaces were loaded beyond approved design limits, which brought about the disintegration of main parts of the aircraft in the air, and its subsequent impact with the ground."
"1968/01/16","Iwakuni, Japan","Mililtary - U.S. Navy",NULL,NULL,"Lockheed P-3A","152144","185-5114",0,1,0,1,0,"Crashed into Kamegamori Mountain, near border between Ehime and Kouchi."
"1968/01/17","Minot AFB, North Dakota","Military - U.S. Air Force",NULL,NULL,"Boeing KC-135A","58-0026","17771/241",0,1,0,1,0,"Rotated too early, stalled and crashed during a snowstorm."
"1968/01/27","Moroni, Comoro Islands","Air Comores",NULL,NULL,"de Havilland DH-114 Heron 1B","F-OECD","14040",1,1,1,1,0,"Touched down on the right side of the runway, bounced, crashed into landing lights and into the sea.Inadequate supervision of the flight by the pilot-in-command."
"1968/02/06","Off Phu Quoc, Vietnam","Military - U.S. Navy",NULL,NULL,"Lockheed P-3B Orion","153440","185-5237",0,1,0,1,0,"Crashed and sank in about 100 feet of water while on patrol."
"1968/02/07","Vancouver, Canada","Canadian Pacific Air Lines","322","Honolulu - Vancouver","Boeing B-707-138B","N791SA","17698/44",5,9,0,1,1,"Visual reference was lost in fog after the flare and prior to touchdown. The aircraft overran the runway and collided with a parked aircraft, some vehicles and two buildings. Failure to evaluate existing terminal weather information and to discontinue the attempt to land."
"1968/02/07","Rohtang Pass, Northern India","Military - Indian Air Force","202","Leh, Kashmir - Chandigarh, Punjab","Antonov AN-12BP","BL534","024003",9,6,9,6,0,"Vanished without a trace over the Himalayas while en route. The remains of one victim from the plane were found in the Rohtang Pass in August 2003. The wreckage itself and other remains would be found in August 2005. Cause unknown, but believed to be premature descent due to bad weather, resulting in a collision with a mountain. On July 15, 2012 the debris was found over Dakka Glacier by mountaineers."
"1968/02/16","Linkuo, Taiwan","Civil Air Transport","10","Hong Kong - Taipei","Boeing B-727-92C","B-1018","19175/339",5,1,1,3,1,"The aircraft descended below the glideslope, struck trees anda house, short of runway, at night, in poor weather. Pilot was not qualified to fly."
"1968/02/21","Eureka, Utah","Havasu City Air - Air Taxi",NULL,NULL,"Cessna 210","N1838F",NULL,2,1,2,1,0,"Undetermined probable cause."
"1968/02/24","Ban Napa, Laos","Royal Air Lao",NULL,"Vientiane - Sayaboury","Douglas DC-3","XW-TAD","26696",3,3,3,3,0,"Crashed into the Mekong River."
"1968/02/29","Near Bratsk, Russia","Aeroflot","15","Krasnoyarsk - Petropavlovsk","Ilyushin IL-18D","CCCP-74252","187010601",7,9,7,9,0,"After an emergency situation and emergency descent the plane broke apart at FL100 and crashed. One passenger survived. Fuel leak."
"1968/02/29","Near Bratsk, Russia","Aeroflot",NULL,"Krasnoyarsk - Petropavlovsk","Ilyushin IL-18D","CCCP-74252","187010601",7,9,7,9,0,"Cruising at flight level 260, some type of emergency developed. An abrupt descent was begun and accelerated until aerodynamic forces broke apart the plane. Cause unknown."
"1968/03/05","Near Khe Sanh, South Vietnam","Military - U.S. Air Force",NULL,"Hue - Khe Sanh","Fairchild C-123K","54-0590","20039",4,4,4,4,0,"The aircraft attempted a go-around after a small plane landed in front of it but was shot down by enemy ground fire. The plane was hit in the right turbine and crashed in flames."
"1968/03/06","Basse-Terre, Guadeloupe, West Indies","Air France","212","Caracas - Pointe a Pitre","Boeing B-707-328C","F-BLCJ","19724",5,1,5,1,0,"After reporting the field in sight, the aircraft struck the ridge of a dormant volcano. The crew initiated a descent from an incorrectly identified point while flying VFR."
"1968/03/08","Off Panay Island, Philippines","Air Manila","507","Manila - Lapu Lapu","Fairchild F-27","PI-C871","0019",1,4,1,4,0,"Cashed into the sea. In-flight structural failure due to air loads exceeding the design strength, while flying into a thunderstorm cell."
"1968/03/09","Near Saint Denis, Reunion","Military - French Air Force",NULL,"Saint Denis - Paris","Douglas DC6B","43748","43748/314",NULL,NULL,NULL,NULL,0,"Crashed into a hill shortly after taking off from the Indian Ocean island. The pilot did not follow the correct departure procedure of turning out towards the ocean after takeoff."
"1968/03/19","Potters Cove, Rhode Island","Viking Airways - Air Taxi",NULL,NULL,"Cessna 182","N2623F",NULL,1,1,1,1,0,"Crashed into the water while attempting to stay below ceiling on dark night. Continued VFR flight into adverse weather conditions."
"1968/03/23","St. Louis, Missouri","Fortaire Aviation - Air Taxi",NULL,NULL,"Brantly 305","N2224U",NULL,4,1,2,1,0,"Crashed while attempting to land. Sank into the Mississippi River. Improper compensation for wind conditions."
"1968/03/24","Off Wexford Harbor, Ireland","Aer Lingus","712","Cork - London","Vickers Viscount 803","EI-AOM","178",5,4,5,4,0,"The aircraft was believed to have gone into a spin or spiral dive with recovery at about 12,000 ft. The dive apparently caused structural damage which resulted in the aircraft plunging into St Georges Channel, 10 miles east of Carnsore Point. Possible causal factors may have been metal fatigue, corrosion, flutter (vibration) or a bird strike."
"1968/03/27","St. Louis, Missouri","Ozark Air Lines / Private",NULL,"Peoria, IL - St. Louis, MO","McDonnell Douglas DC-9 and Cessna 150F","N970Z/N8669G","45772/30",4,6,1,1,0,"Midair collision. Both planes were in a landing pattern. The collision resulted in damage to the DC9s wing with fuel pouring out but the plane was able to make a safe landing.Two killed on the Cessna, no one killed on the DC-9.Inadequacy of current VFR standards. The DC-9 crew not sighting the Cessna in time to avoid it. Congested traffic pattern."
"1968/03/27","Near Moscow, Russia","Military - Russian Air Force",NULL,NULL,"MiG-15 UTI",NULL,NULL,0,2,0,2,0,"Soviet cosmonaut Yuri Gagarin, 34, the first man in space, was killed along with his instructor, when the military fighter they were training in crashed approximately 30 miles east of Moscow."
"1968/04/01","Off Phu Quoc, Vietnam","Military - U.S. Navy",NULL,NULL,"Lockheed P-3B Orion","153445","185-5241",0,1,0,1,0,"Shot down by enemy fire."
"1968/04/08","Heathrow Airport, London, England","British Overseas Airways","712","London - Zurich","Boeing B-707-465","G-ARWE","18373",1,1,4,1,0,"Shortly after leaving the runway during takeoff the No. 2 engine caught fire. Through some confusion, the crew did not pull the fire shutoff handle. The fire continued to burn and while attempting to land, the No. 2 engine fell away. After the plane came to a stop, the wing tank exploded."
"1968/04/08","Near Coyhaique, Chile","Ladeco",NULL,NULL,"Douglas DC-3","CC-CBM","6330",3,3,3,3,0,"Crashed while on approach 5 minutes from its destination. Failure of the right wing."
"1968/04/10","Dahlonega, Georgia","Canair Corp. - Air Taxi",NULL,NULL,"Cessna 182","N3152R",NULL,3,1,3,1,0,"Flew into mountain upslope in rain and fog. Continued VFR flight into adverse weather conditions."
"1968/04/10"," Near Mexico City, Mexico","Aerovias Rojas",NULL,"Aguascalientes - Mexico City","Douglas DC-3","XA-GEV","7339",1,4,1,4,0,"While operating on its inaugural flight the aircraft crashed into a mountain en route after getting lost."
"1968/04/19","Near Cheo Reo, South Vietnam","Military - U.S. Army / Military - U.S. Army",NULL,NULL,"Bell UH-1H / Bell UH-1H (helicopter)","6616441/6717255",NULL,NULL,NULL,NULL,NULL,0,"A mid-air collision occurred between the two helicopters at about 1,000 ft. altitude."
"1968/04/19","Mull of Kintyre, England","Military - Royal Air Force",NULL,NULL,"Avro Shackleton MR-2","WB833",NULL,0,1,0,1,0,"Crashed during anti-submarine exercises."
"1968/04/20","Near Windhoek, South-WestAfrica (Namibia)","South African Airways","228/129","Windhoek - Luanda","Boeing B-707-344C","ZS-EUW","19705",1,1,1,1,0,"The aircraft took off from J. G. Strijdom Airport, climbed to an altitude of 600 ft. and then descended, crashing, about one minute after taking off 3 miles from the runway. Procedural errors during takeoff . Takeoff conditions in total darkness with no external visual reference. Stabilizer trim improperly set, spatial disorientation and preoccupation with after takeoff duties."
"1968/04/22","Moscow, Russia","Aeroflot",NULL,"Training","Ilyushin IL-18V","CCCP-75526","183006804",0,5,0,5,0,"Struck power lines while landing."
"1968/04/27","Carpenteria, California","Utility Helocopter - Air Taxi",NULL,NULL,"Bell 206A","N6275N",NULL,4,1,4,1,0,"Crashed into the ocean 8 miles offshore. Undetermined probable cause."
"1968/04/30","Near Chaklala, West Pakistan","Military - Pakistan Air Force",NULL,NULL,"Lockheed Martin L-100-10","64145",NULL,NULL,NULL,NULL,NULL,0,"Crashed while en route after encountering turbulence, possibly leading to a break-up of the aircraft."
"1968/05/03","Near Dawson, Texas","Braniff Airlines","352","Houston - Dallas-Fort Worth","Lockheed L188A Electra","N9707C","1099",8,5,8,5,0,"On a flight from Houston to Dallas the airliner flew into thunderstorms. While attempting to turn around by making a right hand turn, winds lifted the port wing, forcing the starboard wing down past 90 degrees.A stall resulted from this unusual attitude, pitching the nose down. During the recovery maneuver, the starboard wing was over-stressed, separating from the aircraft followed by the the tail and engines. The aircraft crashed into a field. Pilots decision to penetrate a line of thunderstorms and severe weather. Visual perception of the pilot may have been reduced by a near lightning strike."
"1968/05/07","Got el Afraq, Libya","Military - Royal Air Force",NULL,"Libya - England","Armstrong Whitworth Argosy C-1","XR133","6788",6,5,6,5,0,"The planes wing hit an obstruction, the plane cartwheeled and broke-up and burst into flames. The obstruction was a 45 gallon drum which had been placed about 7 feet high on a structure being used as a shower."
"1968/05/12","Kham Duc, Vietnam","Military - U.S. Air Force",NULL,NULL,"Lockheed C-130B Hercules","60-0297","3600",1,6,1,6,0,"Shot down by enemy fire while attempting to evacuate Kham Duc civilians.The aircraft shookviolently, crashed and burst into flames in a ravine at the end of the airstrip."
"1968/05/14","Pelliston, Michigan","Phillips Flying Service - Air Taxi",NULL,NULL,"Piper PA-23","N4307Y",NULL,3,1,3,1,0,"Collided with trees on final approach in rain, fog and low ceiling. Continued VFR flight into adverse weather conditions."
"1968/05/22","Paramount, California","Los Angeles Airways","841","Anaheim - LAX","Sikorsky S-61L helicopter","N303Y",NULL,2,3,2,3,0,"The helicopter suddenly descended to the ground with an erratic action of the main rotor blades and burst into flames. A faulty main rotor blade damper caused one of the rotor blades to detach for reasons undetermined and strike the fuselage."
"1968/05/28","Near Bombay, India","Garuda Indonesia Airlines",NULL,NULL,"Convair CV-990-30A-5","PK-GJA","30-10-3",1,1,1,1,1,"The aircraft crashed in a nearly vertical attitude, 5 minutes after takeoff, 20 nm from the airport."
"1968/06/01","Vidalia, Georgia","Houston-Beech - Air Taxi",NULL,NULL,"Cessna 411","N7395U",NULL,3,1,2,1,0,"Engine failure on takeoff. Pilot failed to follow proper emergency procedures. Cause of engine failure unknown."
"1968/06/12","Calcutta, India","Pan American World Airways",NULL,"Bangkok - Karachi","Boeing B-707-321C","N798PA","18790/394",5,1,5,1,0,"Crashed1,200 meters short of the runway and hit a tree and caught fire in heavy rain on a night approach. Improper IFR operation. Misused or failed to use flaps. Descended below decision height. The aircraft was named Clipper Caribbean."
"1968/06/18","San Sebastian, Spain","Rinaldo Piaggio",NULL,NULL,"Piaggio PD-808","I-PIAI","503",5,1,5,1,0,"The aircraft flew into the side of Mt. Jaiskibel after turned in the wrong direction."
"1968/06/25","Near Bearcat, South Vietnam","Military - U.S. Army",NULL,NULL,"Bell UH-1H / Bell UH-1H / Bell UH-1H",NULL,NULL,NULL,NULL,NULL,NULL,0,"A mid-air collision between three helicopters at 900 ft. (66-16202) (66-16592) (66-16601)."
"1968/06/28","Vichy, Missouri","Purdue Airlines Inc.",NULL,NULL,"Douglas DC-3 (C-47-DL)","N6898D","20082",2,4,1,0,0,"Passenger inadvertentlly opened air stair door in flight, safety chain failed and passenger fell out."
"1968/07/03","London, England","BKS Air Transport",NULL,"Deauville, France - London, England","Airspeed AS.57 Ambassador 2","G-AMAD","5211",0,8,0,6,0,"The cargo planes left wing struck the ground, the plane struck two other planes, burst into flames and came to rest on its back near a building. Failure of the port flap operating rod due to fatigue, permitting the port flaps to retract. This resulted in a rolling moment to port which could not be controlled."
"1968/07/07","Ft. Lauderdale, Florida","Red Aircraft Service - Air Taxi",NULL,"Ft. Lauderdale - Bahama Island","Piper PA-23","N5694Y",NULL,2,2,2,2,0,"Crashed while en route. Only right wing tip recovered. Undetermined probable cause."
"1968/07/08","Near Dhahran, Saudi Arabia","Saudi Arabian Airlines",NULL,NULL,"Convair CV-340-68B","HZ-AAZ","219",8,3,8,3,0,"Crashed after a third aborted landing attempt in poor visibility and blowing dust. Failure of the captain to maintain minimum altitude for reasons unknown. Poor judgement by the pilot in attempting a fourth landing."
"1968/07/13","Near Lagos, Nigeria","Sabena",NULL,"Brussels - Lagos","Boeing 707-329C","OO-SJK","19211/518",2,5,2,5,0,"The cargo plane descended below mimimum safe altitude and struck trees and crashed."
"1968/07/15","Gravata, Brazil","Varig",NULL,NULL,"Curtiss C-46C","PP-VBJ","33481",0,3,0,3,0,"Struck a mountain."
"1968/07/18","Off Chili","Aerolineas Flecha Austral",NULL,NULL,"Curtiss C-46D","CC-CDI","33445",0,5,0,5,0,"Lost at sea."
"1968/07/28","Near Recife Brazil","Military - U.S. Air Force",NULL,NULL,"Douglas C-124C","51-5178","43588",0,1,0,1,0,"Struck a mountain while en route."
"1968/08/01","Jamestown, Rhode Island","Mid Island Air - Air Taxi",NULL,NULL,"Cessna 182H","N8317S",NULL,2,1,2,1,0,"Struck guy wires of tower while flying below low cloud level. Continued VFR flight into adverse weather conditions."
"1968/08/02","Near Milan, Italy","Alitalia",NULL,"Rome - Milan","McDonnell Douglas DC-8","I-DIWF","45630",8,1,1,0,0,"Crashed on approach, 7 miles north of the runway. Positioning for final approach by means of a non-standard procedure. Delayed detection of the VOR radial."
"1968/08/04","Milwaukee, Wisconsin","North Central Airlines / Private",NULL,NULL,"Convair CV-580 / Cessna 150","N4634S / N8742S","176 / ?",1,5,2,1,0,"Midair collision with the Cessna which became embedded in the forward baggage compartment.Three person on the Cessna were killed none on the Convair.Lack of VFR separation. Inability of the Convair crew to detect the Cessna in sufficient time to take evasive action despite having been provided with three radar traffic advisories. Visual detection capabalities were substantially reduced by heavy accumulation of insect smears on the windshield and by haze, smoke and sun glare."
"1968/08/09","Pfaffenhofen, Germany","British Eagle International Airlines",NULL,"London - Innsbruck","Vickers Viscount 739A","G-ATFN","394",4,4,4,4,0,"The aircraft broke up in-flight after plunging from 21,000 ft. Failure of the aircrafts electrical DC generator control system."
"1968/08/10","Charleston, West Virginia","Piedmont Airlines","230","Cincinnati - Charleston, WV","Fairchild-Hiller FH-227B","N712U","557",3,3,3,3,0,"Crashed on approach to Kanawha County Airport in poor visibility. The aircraft was being operated under VFR when it entered a shallow fog overlying the approach lights.Unrecognized loss of altitude orientation during the final portion of the approach into shallow, dense fog. Disorientation caused by rapid reduction in the ground guidance segment available to the pilot at a point beyond which a go-around could not be initiated."
"1968/08/14","Compton, California","Los Angeles Airways","417",NULL,"Sikorsky S-61L helicopter","N300Y",NULL,1,3,1,3,0,"The main rotor blade of the helicopter separated from the central hub. The aircraft spun to destruction as the tail cone sheared off. Metallurgical fault during manufacture of the main rotor blade spindle. Fatigue origin in area of substandard hardness and inadequate shot peening on main rotor blade spindle."
"1968/08/18","Off Port Said, Egypt","United Arab Airlines",NULL,"Cairo - Damascus","Antonov AN-24V","SU-AOL","67302806",3,7,3,7,0,"Ditched into the Mediterranean sea. Cause unknown."
"1968/08/20","Near Maturin, Venezuela","Linea Aeropostal Venezolana",NULL,NULL,"Hawker Siddeley HS-748-215-2","YV-C-AMY","1580",4,3,2,2,0,"The plane crashed while returning to the airport for an emergency landing after the No. 1 engine failed on takeoff."
"1968/08/28","Lopez, Washington","Island Sky Ferry - Air Taxi",NULL,NULL,"Cessna 172","N2520Y",NULL,1,1,1,1,0,"Misjudged altitude and crashed into water.Right wing struck open water during a low turn away from a fog bank. Continued VFR flight into adverse weather conditions."
"1968/08/31","Near Odda, Norway","Westwing",NULL,NULL,"de Havilland Canada DHC-3 Otter","LN-BFD","199",NULL,NULL,NULL,NULL,0,"Crashed into a hill in poor weather conditons while flying raindeer hunters to a mountain location. One man survived by jumping from the plane seconds before it caught fire."
"1968/09/03","Near Burgas, Bulgaria","Bulair TABSO",NULL,NULL,"Ilyushin IL-18","LZ-BEG","187009101",8,7,4,5,0,"Crashed on approach descending into the ground short of the runway. Deviation from the prescribed flight rules to accomplish a visual approach in adverse weather conditions."
"1968/09/08","Flushing, New York","Far Aviation - Air Taxi / Speeds Flying - Air Taxi",NULL,NULL,"Cessna 402 / Piper PA-28","N8283F / N8828W",NULL,7,2,1,1,0,"Midair collision. Pilot of Cessna failed to see and avoid other aircraft. Two aboard the Piper killed."
"1968/09/11","Off Cap dAntibes, France","Air France","1611","Ajaccio - Nice","Sud-Aviation Caravelle 3","F-BOHB","244",8,6,8,6,0,"The airliner crashed into the Mediterranean sea, 10 miles south of Nice Airport, while attempting an emergency landing 21 minutes after taking off. Prior to the crash a message was received that there was fire aboard in the rear of the cabin."
"1968/09/24","Wake Island","Military - U.S. Air Force",NULL,NULL,"Boeing KC-135A","55-3133","17249/16",NULL,NULL,NULL,NULL,0,"Experienced engine trouble and divered to Wake. The plane skidded on the runway with the tail on fire."
"1968/09/28","Port Harcourt, Biafra, Nigeria","Pan African Airlines",NULL,"Lagos - Port Harcourt","Douglas C-54B","N90427","10445",5,2,5,2,1,"While on final approach, the aircraft hit trees and crashed into a village and caught fire."
"1968/10/01","Kenai, Alaska","Kenai Air Service - Air Taxi",NULL,NULL,"Beechcraft D50A","N674T",NULL,1,2,1,2,0,"Aircraft crashed on tide flats shortly after take off. Undetermined probable cause."
"1968/10/03","Near Camp Evans, South Vietnam","Military - U.S. Air Force / Military -U.S. Army",NULL,NULL,"de Havilland C-7B / Boeing Vertol CH-47A","639753/6619041","213",NULL,NULL,NULL,NULL,0,"A mid-air collision between the fixed-wing aircraft and helicopter at the de Havilland C-7A prepared to land and the Boeing Vertol took off."
"1968/10/08","Puerto Cortes, Costa Rica","Aerovias del Valle",NULL,NULL,"Britten-Norman BN-2 Islander","TI-1063C","14",9,1,9,1,0,"Crashed while attempting to land."
"1968/10/08","Las Vegas, Nevada","Catalina - Vega - Air Taxi",NULL,NULL,"de Havilland DH-104","N4040B",NULL,2,2,2,2,0,"Fire and explosion in flight during initial climb. Undetermined origin under cockpit floorboard."
"1968/10/10","Derry, Pennsylvania","Augusta Aviaiton - Air Taxi",NULL,NULL,"Piper PA-23","N5140Y",NULL,2,1,1,1,0,"Collision with side of mountian. Improper IFR operation. Pilot did not follow published ADF approach. Premature descent."
"1968/10/11","Near Prague, Czechoslovakia","Ceskoslovenske Aerolinie",NULL,"Praha - Kosice","Avia 14-40","OK-MCY","805120",3,3,8,3,0,"Crashed shortly after takeoff."
"1968/10/19","Near Izmir, Turkey","Military - Turkish Air Force",NULL,NULL,"Lockheed C-130E Hercules","17949","4100",NULL,NULL,NULL,NULL,0,"Struck a mountain."
"1968/10/20","Feijó, Brazil","Cruzeiro",NULL,NULL,"Douglas C-47A-25","PP-SAD","13764",NULL,NULL,NULL,NULL,0,"Tried to return to the airport for an emergency landing after an engine failed."
"1968/10/21","Near Ban Me Thuot, South Vietnam","Military - U.S. Air Force",NULL,"Saigon - Da Nang","Douglas C-47D","450934",NULL,NULL,NULL,NULL,NULL,0,"The aircraft crashed en route after the pilot transmitted a Mayday reporting the failure of the No. 2 engine and inability to feather the propeller. It crashed 20 miles from the airfield it intended to make an emergency landing at."
"1968/10/25","Hanover, New Hampshire","Northeast Airlines","946","Boston, MA - Montpelier, VT - Lebanon, NH","Fairchild-Hiller FH227C","N380NE","517",3,3,3,2,0,"The aircraft crashed into Moose Mountain during an approach. Execution of a non-standard approach.Premature descent. The crew was not able to determine accurately its position because they had performed a non-standard instrument approach and there were no supplement navigational aids available for their use."
"1968/11/21","Barrow, Alaska","Barrow Air Service - Air Taxi",NULL,NULL,"Aero Commander 680-E","N3810C",NULL,7,1,6,1,0,"Engine failure on climb out for undetermined reasons. Aircraft allowed to enter condition of asymmetrical thrust. Improper emergency procedures. Aircraft overloaded by 475 lbs."
"1968/11/22","Off San Francisco, California","Japan Air Lines","2","Tokyo - San Francisco","McDonnell Douglas DC-8-62","JA8032","45954/362",9,1,0,0,0,"The plane landed in the shallow waters of San Francisco Bay, 2.5 mile short of the Runway 28L. All 107 people aboard were safely evacuated off the plane without injury. According to the NTSB, the captain said he was making a coupled approach, but because of problems with his pressure altimeter, he was relying on the more accurate radio altimeter for verification of altitude. The captain looked up expecting to be 200 feet above the water but instead was nearly in the water. He applied power but it was too late. The captain did not cross-check the raw data glide-slope signals and didnt realize the ILS on-course position was far above where he was. Theimproper application of the prescribed procedures to execute an automatic-coupled ILS approach. This deviation from the prescribed procedures was, in part, due t o a lack of familiarization and infrequent operation of the installed flight director and autopilot system.As a result, Japan Air Lines changed their training procedures to stress command responsibilities, crew coordination and transition time for new type of aircraft. The aircraft was recovered from the San Francisco Bay 55 hours after the accident, repaired at a United Air Lines facility and eventually flow back to Japan where it was putin service for many decades."
