"1968/11/23","Santa Ana, California","Cable Commuter","544","Los Angeles - Santa Ana","de Havilland Canada DHC-6 Twin Otter 200","N7666","148",7,2,7,2,0,"While on approach to the airport, in dense fog, the aircraft descended prematurely and its left wing clipped a 30 ft. light pole on the grounds of a fire station 1.8 miles northwest of the runway threshold. The plane then veered into the adjacent elevated western embankment of a freeway and broke up, spewing flaming wreckage across all six traffic lanes. Improper IFR operation. Misjudged altitude."
"1968/11/25","Savannakhet, Laos","Air America",NULL,NULL,"Curtiss C-46D-20-CU","N1386N","22265",2,3,2,3,0,"Crashed shortly after taking off."
"1968/11/26","Point Baker, Alaska","Stikine Air Service - Air Taxi",NULL,NULL,"Cessna 185","N2202T",NULL,4,1,2,0,0,"Failed to maintain directional control on take off and crashed. Left float struck rock. Took off at low tide in quartering tail wind."
"1968/12/02","Pedro Bay, Alaska","Wien Consolidated Airlines","55","Anchorage - Iliamna","Fairchild F-27B","N4905","0049",3,3,3,3,0,"Broke up in severe turbulence at 11,500 feet. Failure of the right wing that was weakened by pre-existing fatigue cracks.The turbulence was not forcast and not known to the flight crew.Improper maintenance. Incorrect weather forcast."
"1968/12/06","St. Thomas, Virgin Islands","Conquest Airways - Air Taxi",NULL,NULL,"Beechcraft E18S","N433AC",NULL,1,1,2,1,0,"Aircraft failed to maintain flying speed during initial climb. Center of gravity aft of limits. Possible misuse of flaps."
"1968/12/08","Wolf Creek, Montana","Northwest Moon - Air Taxi",NULL,NULL,"Aero Commander 560-F","N6257X",NULL,2,1,2,1,0,"Crashed while en route. Pilot flew into icing conditions and turbulence.Continued VFR flight into adverse weather conditions."
"1968/12/12","Near Caracas, Venezuela","Pan American World Airways","217","New York City - Caracas","Boeing B-707-321B","N494PA","19696/688",4,9,4,9,0,"En route from New York City, the airliner crashed in the Caribbean sea and exploded while descending for a landingat Maiquetia Airport. Possible sensory illusion produced by the town lights on upslope. The aircraft was named Clipper Malay."
"1968/12/24","Bradford, Pennsylvania","Allegheny Airlines","736","Detroit - Erie - Bradford - Washington D.C.","Convair CV-580","N5802","410",4,6,1,3,0,"The aircraft crashed into trees in the snow, 2.5 miles short of the runway, during an instrument approach. Continuation of the descent below minimum descent altitude into obstructing terrain while both pilots were looking outside to establish visual reference to the ground. Improper IFR operation. Misread or failed to read instruments."
"1968/12/24","Prudhoe Bay, Alaska","Interior Airways",NULL,"Fairbanks - Prudhoe Bay","Lockheed L-100 Hercules","N760AL","4229",0,4,0,2,0,"The cargo plane crashed after a go-around was attempted in a snowstorm. Pilot in command continued VFR flight into adverse weather conditions and delayed in initiating go around. Weather conditions - down and up drafts."
"1968/12/26","Ensenada, Mexico","Exportada De Sal S.A.",NULL,"Tijuana - Black Warrior Lagoon, Baja","Douglas DC-3",NULL,NULL,1,2,1,2,0,"Crashed into a mountain after being blown off course by a storm while en route."
"1968/12/26","Elmendorf Air Force Base, Alaska","Pan American World Airways",NULL,"San Francisco - Anchorage - Cam Ranh Bay, Vietnam","Boeing 707-321CF","N799PA",NULL,0,3,0,3,0,"The stickshaker sounded shortly after VR. The aircraft rotated and climbed slowly.The right wing contacted the snow covered ground 94 feet left of the extended centerline at a distance of 2,760 feet from the runway.The aircraft rolled inverted and broke up.The probable cause was an attempted takeoff with the flaps in a retracted position. This resulted from a combination of factors: a) inadequate cockpit checklist and procedures; b) a warning system inadequacy associated with cold weather operations; c) ineffective control practices regarding manufacturers Service Bulletins; and d) stresses imposed upon the crew by their attempts to meet an air traffic control deadline."
"1968/12/27","Chicago, Illinois","North Central Airlines","458","Minneapolis - Chicago - Milwaukee","Convair CV-580","N2045","369",4,4,2,3,1,"The aircraft crashed during an instrument approach after a go-around, nearly inverted, into a hangar. Spacial disorientation of the crew precipitated by refraction of the landing or approach lights during transition from flying IFR to visual reference to the ground."
"1968/12/31","Near Ciudad Victoria, Mexico","Servicios Aéreos Especiales",NULL,"Reynosa - Tampico","Douglas DC-3","XA-SAE","20554",2,4,2,4,0,"Crashed into a mountain."
"1968/12/31","Port Hedland, WA, Australia","MacRobertson Miller Airlines","1750","Perth - Port Hedland","Vickers Viscount 720","VH-RMQ","045",2,5,2,5,0,"Last radio contactfrom the aircraft was at 11:34 local 30 DME south of Port Hedland in moderate turbulence. The aircraft was seen descending rapidly. Wreckage was found 28 miles south of Port Hedland. The accident was caused by a crack originating at a bolt hole in the wing spar. Also, it was found that someonehad carried out an incorrect procedure on the spar, by forcing an oversize bush into the housing of the lower spar boom, resulting in damage which exacerbated the spread of the hairline fracture."
