"1979/12/03","Nome, Alaska","Evergreen Helicopter - Air Taxi",NULL,"Nome, AK - Return","de Havilland DHC-6","N8061V","294",2,2,2,2,0,"Crashed in snow, low ceiling and fog while en route. Continued VFR flight into adverse weather."
"1979/12/09","Cherskiy, Russia","Aeroflot",NULL,NULL,"Antonov AN-26","CCCP-26547","2810",2,5,2,5,0,"Shifting cargo caused the pilot to lose control and crash into a hotel."
"1979/12/12","Apolo, Bolivia","CAMBA",NULL,NULL,"Martin 404","CP-1440","14114",NULL,NULL,NULL,NULL,0,NULL
"1979/12/19","Cerro Toledo Mountain, Colombia","SATENA",NULL,"Arauca - Bogota","Douglas DC-4 (C-54)","FAC-1106","10853",1,4,1,4,0,"Flew into a mountain."
"1979/12/22","Near Puerto Esperanza, Peru","Fuerza Aérea del Peru",NULL,"Pucallpa - Puerto Esperanza","de Havilland Canada DHC-5 Buffalo","FAP-348","55",2,5,2,5,0,"Crashed into the jungle on a domestic flight 20 miles from its destination. Severe thunderstorms associated with windshear anda hurricane is believed to have caused the crash."
"1979/12/23","Menari, Papua New Guinea","Douglas Airways",NULL,NULL,"GAF Nomad 22B","P2-DNL","039",1,2,1,2,0,"Crashed into the side of a mountain."
"1979/12/23","Ankara, Turkey","Turkish Airlines (THY)",NULL,"Ankara - Samsun","Fokker F-28 Fellowship 1000","TC-JAT","11071",4,4,3,3,0,"Crashed into Cubuk Hill in fog, two minutes away from landing at the airport.In-flight structural failure due to severe turbulence. The aircraft was named Trabzon."
