"2000/08/23","Off Manama, Bahrain","Gulf Air","072","Cairo - Manama","Airbus A320-212","A4O-EK","0481",1,8,1,8,0,"The aircraft crashed into the Persian Gulf and exploded in flames while attempting to land at Bahrain International Airport. The crew decided to perform a missed approach after it was determined the aircraft was coming in too high and fast. Instructions were given for a 180 degree turn and climb to 2,500 feet. While performing the missed approach the plane suddenly descended rapidly from an altitude of 1,000 feet and crashed into the shallow waters of the gulf approximately 1 mile from the airport. The accident was a result of a fatal combination of factors, including the captains failure to comply with standard operating procedures and the copilots actions in not drawing the captains attention to the deviations of the aircraft from the standard flight parameters. The captain may have suffered a spatial disorientation to ground warning systems, which could have made him falsely perceive the aircraft was pitching up. He responded by making a nose down input, resulting in the aircraft starting to descend, when aircraft warning systems were saying he should increase altitude."
"2000/08/25","Hilo Bay, Hawaii","Big Island Airlines","57","Sightseeing","Piper PA-31-350 Navajo Chieftain","N923BA","31-8252024",8,1,1,0,0,"The aircraft, was on an around-the-island tour when its right engine caught fire. While attempting an emergency landing at Hilo International Airport, the plane ditched into Hilo Bay. Eight people escaped from the plane before it sank in 100 feet of water. One passenger was not able to exit the plane and drowned. Possible failure of the turbo unit on the right engine."
"2000/08/26","Near La Fortuna, Costa Rica","SANSA","1644","San Jose- La Fortuna - Tamarindo","Cessna 208B Grand Caravan I","HP-1357AAP","208B-0709",8,2,8,2,0,"The plane crashed head-on into 5,360 ft. Arenal volcano, 95 miles north of San Jose shortly after taking off from La Fortuna. The pilot was flying VFR and deviated from his course by 12 miles, most likely to give passengers a view of the volcano which had erupted earlier in the week. The reason the crew did not see the volcano is not known. Possibly, with changing meteorological conditions in the area, the volcano may have been obscured by clouds. The plane, built in 1998, had been leased from Aeroperlas."
"2000/09/02","Mount Montezuma, Colombia","Military - Fuerza Aérea Colombiana",NULL,NULL,"Douglas C-47","FAC1659","32984",0,7,0,7,0,"Flew into Mt. Montezuma."
"2000/09/04","Near Burketown, Australia","Charter - Central Air",NULL,"Perth - ?","Beechcraft SKA 200","VH-SKC","BB-47",7,1,7,1,0,"Shortly after departing Perth and after the aircraft had climbed through its assigned altitude, the pilot’s speech became significantly impaired and he appeared unable to respond to ATS instructions. Open microphone transmissions over the next 8-minutes revealed the progressive deterioration of the pilot towards unconsciousness and the absence of any sounds of passenger activity in the aircraft. No human response of any kind was detected for the remainder of the flight. Five hours after taking off from Perth, the aircraft impacted the ground 65 km ESE of Burketown, Queensland, and was destroyed. Incapacitation of the pilot and passengers a result of hypobaric hypoxia due to the aircraft being fully or partially unpressurised and their not receiving supplemental oxygen. The investigation could not determine the reason for the aircraft being unpressurised, or why the pilot and passengers did not receive supplemental oxygen."
"2000/09/16","Kumarapura, Sri Lanka","Military - Sri Lanka Air Force",NULL,"Colombo - Kalmunai","Mil Mi-17",NULL,NULL,1,2,1,2,0,"The Air Force helicopter was on a domestic flight when it cashed into mountainous terrain 75 km from Colombo. The helicopter’s pilot had contacted air traffic controllers saying he had problems with visibility and was lowering his altitude. Sri Lanka, Muslim Congress leader M. H. M. Ashraff, 52, along with members of his entourage were killed."
"2000/09/18","Nuiqsut, Alaska","Cape Smythe Air Service","181","Deadhorse - Nuiqsut","Piper PA-31-350 Navajo","N220CS","8275013",9,1,4,1,0,"The belly cargo podlightly scraped the runway for about 40 feet, but the airplane transitioned to a climb. As the airplane began climbing away from the runway, the landing gear was observed to extend. The airplane climbed to about 100 to 150 feet above the ground, and then began a descending left turn. The airplane collided with the ground on a 95 degree heading. The wreckage path extended for about 300 feet, during which the landing gear, left wing, and the left engine separated from the airplane. A postcrash fire destroyed the fuselage, right wing, and the right engine. The pilots failure to extend the landing gear, his improper aborted landing procedure, and inadvertent stall/mush. Factors in the accident were an improper adjustment of the landing gear warning horn system by company maintenance personnel, and the failure of the pilot to utilize the prelanding checklist."
"2000/10/06","Reynosa, Mexico","Aeromexico","250","Mexico City - Reynosa - Matamoros","McDonnell Douglas DC-9-31","N936ML","47501/571",8,5,0,0,4,"The aircraft overshot the runway near Reynosa, Mexico and crashed into vehicles and houses coming to rest in a canal. The accident happened during a heavy rainstorm. The lights at the airport were out due to the storm and contact with the tower was lost. No passengers were killed aboard the aircraft but four people were killed on the ground."
"2000/10/08","Port Radium, Northwest Territories, Canada","Summit Air Charters",NULL,"Kuglluktuk - Yellowknife","Shorts SC.7 Skyvan 3-100","C-FSDZ","SH-1953",1,2,1,2,0,"The chartered cargo plane hit tree tops and discintegrated while attempting to land. Although the pilot and the aircraft were certified for instrument flight, the pilot apparently continued to fly in accordance with visual flight rules after encountering marginal weather conditions and reduced visibility. For undetermined reasons, the pilot descended below the elevation of the terrain surrounding the airstrip, resulting in a controlled-flight-into-terrain accident."
"2000/10/09","Lummi Island, Washington","Empire Airlines","665","Bellingham - Eastsound-Orcas Island","Cessna 208B Caravan I Super Cargomaster","N941FE","208B-0192",0,1,0,1,0,"After receiving special VFR clearance the cargo plane flew into a small hill. The pilots attempted flight into known adverse weather conditions, and his subsequent failure to maintain altitude above, or clearance with, trees. Factors contributing to the accident included low ceilings, fog, the pilots low-altitude flight, rising terrain, and trees."
"2000/10/10","Wichita, Kansas","Bombardier Aerospace",NULL,"Test flight","Canadair CL-600-2B16 Challenger 604","C-FTBZ","5991",0,3,0,2,0,"The cause of this accident was the pilots excessive takeoff rotation, during an aft center of gravity takeoff, a rearward migration of fuel during acceleration and takeoff and consequent shift in the airplanes aft c.g. to aft of the aft c.g. limit, which caused the airplane to stall at an altitude too low for recovery. Contributing to the accident were Bombardiers inadequate flight planning procedures for the Challenger flight test program and the lack of direct, on-site operational oversight by Transport Canada and the Federal Aviation Administration."
"2000/10/16","Hillsboro, Missouri","Private",NULL,"St. Louis - New Madrid","Cessna 335","N8354N","335-0064",2,1,2,1,0,"The twin engine Cessna crashed into a densely wooded area, 30 miles south of St. Louis, 25 minutes after taking off from Parks Airport. The plane was flying in rain and fog when the pilot reported he was at 6,500 feet and having problems with the artificial horizon. Radar contact was soon lost with the aircraft.Witnesses reported hearing a plane in a dive followed by an explosion.Wreckage was scattered over a wide area.Mel Carnahan, 66, Governor of Missouri was killed in the accident along with a campaign aide and his son, Roger, who was piloting the plane."
"2000/10/19","Near Sam Neua, Laos","Lao Aviation","703","Vientiane - Sam Neua","Harbin Yunshuji Y-12-II","RDPL-34130","86",1,2,8,0,0,"The aircraft crashed into a mountain at 4,800 ft., in poor weather, while making an apporach to Sam Neua."
"2000/10/25","Near Batumi, Republic of Georgia","Military - Russian Air Force",NULL,"Moscow - Batumi","Ilyushin IL-18D","RA-74295","187010602",7,1,7,1,0,"Communications were lost with the aircraft as it approached Mt. Tirina at 4,250 feet, preparing to land at Batumi. The aircraft was seen rapidly descending into mountainous terrain. A large explosion followed as the plane crashed somewhere between the towns ofBatumi and Kabuleti in heavy rain. Navigation error made by the crew in the final stage of the landing approach. Error by the Batumi ATC who failed to locate the plane and conform it to the crew. Erroneous data shown by ground radio-technical facilities at Batumi airport."
"2000/10/31","Taipei, Taiwan","Singapore Airlines","006","Taipei - Los Angeles","Boeing B-747-412","9V-SPK","28023/1099",1,2,7,4,0,"Weather conditions at the time were extremely poor due to typhoon Xiang Sane. A NOTAM issued on Aug 31, 2000 indicated that Runway 05R was closed due to construction between Sep 13 and Nov 22. After reaching the end of Taxiway NP, the plane turned onto Taxiway N1 and then made a 180-degree turn onto Runway 05R and began its takeoff roll. Approximately 3.5 seconds after reaching V1, the aircraft hit construction equipment on the runway, crashed back to the ground, broke up and burst into flames. The pilot attempted to take off from a closed runway. The following factors contributed to the accident. Of three lights used to guide the aircraft onto the correct runway, one was not working and another dim. The airport lacked guard lights used to help pilots navigate from the taxiway to the correct runway during times of poor visibility. International regulations require that a large white X be placed on the tarmac at the entrance to a closed runway, but there was none at the entrance of runway 5R. Whether there should have been, in this case, however, is itself a contentious matter as the runway remained open for taxiing."
"2000/10/31","Near Monaquimbundo, Angola","Aca-Ancargo",NULL,"Saurimo - Luanda","Antonov AN-26","D2-FDI","27312009",3,5,3,5,0,"The aircraft exploded in midair 20 minutes after taking off from Saurimo. UNITA rebels claimed they shot down the plane."
"2000/11/07","Luabo, Democratic Republic Congo","Malu Aviation",NULL,NULL,"Antonov 32B","ER-AFA","3406",5,6,1,1,0,"Due to a blown tire on takeoff the pilot aborted the takeoff, overran the runway, came to rest in a cemetery and caught fire."
"2000/11/09","Fort Wayne, Indiana","Superior Aviation",NULL,"Fort Wayne, IN - Milwaukee, WI","Swearingen SA.226TC Metro II","N731AC","TC-255",0,1,0,1,0,"During takeoff, the cargo plane struck trees, crashed and caught fire. The indicated failure of the right hand AC bus during takeoff with low ceiling. The factors were the low ceiling, night, and the execssive workload the pilot experienced on takeoff with an electrical failure without a second in command."
"2000/11/15","Near Luanda, Angola","Asa Pesada",NULL,"Luanda - Namibe","Antonov AN-26","D2-FCG","PESA001",5,5,5,5,0,"The plane crashed and exploded in flames into an open field 3 miles from the runway shortly after takeoff.Engine failure."
"2000/11/20","Miami, Florida","American Airlines",NULL,"Miami, FL - Port au Prince","Airbus A300-600R","N14056","463",1,9,0,1,0,"After climbing through 16,000 ft. the crew descovered cabin pressure could not be maintained and returned to the airport.After landing the ram air switch failed to depressurize the aircraft. Moments later the left foreward door exploded open ejecting a flight attendant onto the tarmac."
"2000/11/25","Cordoba, Spain","Mayoral Executive Jet",NULL,"Malaga - Cordoba","Aerospatiale SN-601 Corvette","EC-DQG","27",0,2,0,1,0,"During the approach, the plane, on a positioning flight, hit electric lines, then the ground and finally an unoccupied building."
"2000/12/11","Near Sumacal, Beni, BO","Servicio Aereo Manchupo",NULL,"Cashaschanes - Sumacal","Cessna 206","CP-1721",NULL,5,1,5,1,0,"Destabilized approach, attempted to establish runway alignment, insufficient altitude, struck a tree. The aircraft crashed and caught fire."
